{
  "schema_version": 1,
  "report_path": "ai-learning/reports/knowledge_reports/GPT6_Astra指令架构_从Prompt堆叠到按需控制_深度解析_20261015.md",
  "quality_tier": "important",
  "revision_round": 1,
  "reviews": [
    {
      "role": "primary_review",
      "reviewer": {
        "model": "gpt-5.6-sol",
        "harness": "codex",
        "run_id": "replay-review-astra-20261015",
        "independent_context": true,
        "explicit_model_override": false,
        "override_reason": ""
      },
      "escalation_reason": "",
      "scores": {
        "evidence_fidelity": 97,
        "request_coverage": 98,
        "reasoning_quality": 96,
        "readability": 95,
        "limitations": 95
      },
      "score_reasons": {
        "evidence_fidelity": "逐项回查 OpenAI 原文与提示指南，关键论断均能定位；工程推论已单独标注。",
        "request_coverage": "覆盖原文拆解、反例、EverAgent 映射、实施建议和评估方法。",
        "reasoning_quality": "从模型行为到 context 分层的推导完整，并明确官方经验不等于因果实验。",
        "readability": "先给一页结论，再展开证据与实施路径，可独立阅读。",
        "limitations": "明确记录官方材料缺少量化实验及本地回放仍需积累。"
      },
      "critical_claim_ids_checked": [
        "C01",
        "C02",
        "C03",
        "C04"
      ],
      "source_ids_checked": [
        "S01",
        "S02",
        "S03",
        "S04"
      ],
      "requirement_ids_checked": [
        "R01",
        "R02",
        "R03"
      ],
      "unsupported_claims": [],
      "missing_requirements": [],
      "hard_failures": [],
      "notes": "以 2026-10-15 再次读取的 OpenAI 官方页面复核；报告可作为结构与证据纪律锚点。"
    }
  ],
  "decision": {
    "status": "pass",
    "score": 96.5,
    "evaluated_on": "2026-10-15",
    "policy_id": "report-quality-2026-10-15-r1",
    "policy_sha256": "69eb1667e587b2e30f4141910049d8a6f7383b16059125c867ee09a23ac37268",
    "report_sha256": "224981c65e0a4b5956b6c7d5976a9655f8eef477e4810066ef8a595435116586",
    "evidence_sha256": "b2bc2c673e4de18a2767df69b335841fe46b65841cc2a5da40ac5d24dbfaca65"
  }
}
